<?xml version="1.0"?>
<messages xmlns:xsi="http://www.w3.org/2001/XMLSchema-instance"
xsi:noNamespaceSchemaLocation="../../../xml-types/conversation.xsd">
    <message>
        <sender>patient</sender>
        <receiver>doctor</receiver>
        <type>text</type>
        <text>Salve dottore come va?</text>
        <dateTime>Mon Jun 01 10:54:00 CEST 2015</dateTime>
    </message>
    <message>
        <sender>doctor</sender>
        <receiver>patient</receiver>
        <type>text</type>
        <text>Salve tutto bene lei?</text>
        <dateTime>Mon Jun 01 10:54:00 CEST 2015</dateTime>
    </message>
    <message>    
        <sender>patient</sender>
        <receiver>doctor</receiver>
        <type>text</type>
        <text>Non saprei ho una accetta piantata in testa cosa mi consiglia?</text>
        <dateTime>Mon Jun 01 10:54:00 CEST 2015</dateTime>
    </message>
    <message>
        <sender>doctor</sender>
        <receiver>patient</receiver>
        <type>text</type>
        <text>Lascia l'ascia ma accetta l'accetta!</text>
        <dateTime>Mon Jun 01 10:54:00 CEST 2015</dateTime>
    </message>
    <message>
        <sender>patient</sender>
        <receiver>doctor</receiver>
        <type>text</type>
        <text>Salve dottore come va?</text>
        <dateTime>Mon Jun 01 10:54:00 CEST 2015</dateTime>
    </message>
    <message>
        <sender>doctor</sender>
        <receiver>patient</receiver>
        <type>text</type>
        <text>Salve tutto bene lei?</text>
        <dateTime>Mon Jun 01 10:54:00 CEST 2015</dateTime>
    </message>
    <message>
        <sender>patient</sender>
        <receiver>doctor</receiver>
        <type>text</type>
        <text>Non saprei ho una accetta piantata in testa cosa mi consiglia?Non saprei ho una accetta piantata in testa cosa mi consiglia?</text>
        <dateTime>Mon Jun 01 10:54:00 CEST 2015</dateTime>
    </message>
    <message>
        <sender>doctor</sender>
        <receiver>patient</receiver>
        <type>text</type>
        <text>Lascia l'ascia ma accetta l'accetta!</text>
        <dateTime>Mon Jun 01 10:54:00 CEST 2015</dateTime>
    </message>
    <message>
        <sender>patient</sender>
        <receiver>doctor</receiver>
        <type>text</type>
        <text>Salve dottore come va?</text>
        <dateTime>Mon Jun 01 10:54:00 CEST 2015</dateTime>
    </message>
    <message>
        <sender>doctor</sender>
        <receiver>patient</receiver>
        <type>text</type>
        <text>Salve tutto bene lei?</text>
        <dateTime>Mon Jun 01 10:54:00 CEST 2015</dateTime>
    </message>
    <message>    
        <sender>patient</sender>
        <receiver>doctor</receiver>
        <type>text</type>
        <text>Non saprei ho una accetta piantata in testa cosa mi consiglia?Non saprei ho una accetta piantata in testa cosa mi consiglia?</text>
        <dateTime>Mon Jun 01 10:54:00 CEST 2015</dateTime>
    </message>
    <message>
        <sender>doctor</sender>
        <receiver>patient</receiver>
        <type>text</type>
        <text>Lascia l'ascia ma accetta l'accetta!</text>
        <dateTime>Mon Jun 01 10:54:00 CEST 2015</dateTime>
    </message>
    <message>
        <sender>patient</sender>
        <receiver>doctor</receiver>
        <type>text</type>
        <text>Salve dottore come va?</text>
        <dateTime>Mon Jun 01 10:54:00 CEST 2015</dateTime>
    </message>
    <message>
        <sender>doctor</sender>
        <receiver>patient</receiver>
        <type>text</type>
        <text>Salve tutto bene lei?</text>
        <dateTime>Mon Jun 01 10:54:00 CEST 2015</dateTime>
    </message>
    <message>
        <sender>patient</sender>
        <receiver>doctor</receiver>
        <type>text</type>
        <text>Non saprei ho una accetta piantata in testa cosa mi consiglia?Non saprei ho una accetta piantata in testa cosa mi consiglia?</text>
        <dateTime>Mon Jun 01 10:54:00 CEST 2015</dateTime>
    </message>
    <message>
        <sender>doctor</sender>
        <receiver>patient</receiver>
        <type>text</type>
        <text>Lascia l'ascia ma accetta l'accetta!</text>
        <dateTime>Mon Jun 01 10:54:00 CEST 2015</dateTime>
    </message>
</messages>